{"schema_version":1,"task":{"id":"task_test","kind":"implement","scope":["calc"],"target":{"def":"calc.clamp","obligation":null},"counterexample":null,"budget":{"iterations":4,"tokens":0,"wall_ms":900000},"context_policy":"module","origin":null,"description":null,"escalation":{"helpers":false,"alternate_model":null}},"status":"blocked","cause":"stall","generated":{"at":"<at>","model":"scripted"},"interface_diff":[],"ledger_delta":[],"body_diff":[],"trace":[{"iteration":1,"model":"scripted","prompt_hash":"<hash>","diagnostics_before":1,"diagnostics_after":1,"codes_after":["E0702"],"failing_tests":[],"mechanical_repairs":0,"tokens":0,"ms":0,"classification":"progress","escalation":null},{"iteration":2,"model":"scripted","prompt_hash":"<hash>","diagnostics_before":1,"diagnostics_after":1,"codes_after":["E0702"],"failing_tests":[],"mechanical_repairs":0,"tokens":0,"ms":0,"classification":"stall","escalation":null},{"iteration":3,"model":"scripted","prompt_hash":"<hash>","diagnostics_before":1,"diagnostics_after":1,"codes_after":["E0702"],"failing_tests":[],"mechanical_repairs":0,"tokens":0,"ms":0,"classification":"stall","escalation":"full diagnostic history"},{"iteration":4,"model":"scripted","prompt_hash":"<hash>","diagnostics_before":1,"diagnostics_after":1,"codes_after":["E0702"],"failing_tests":[],"mechanical_repairs":0,"tokens":0,"ms":0,"classification":"stall","escalation":"context policy scope"}],"metrics":{"iterations":4,"mechanical_repairs":0,"escalation_steps":3,"proposals":0,"tokens":0},"proposals":[],"audit":[],"last_diagnostics":[{"code":"E0702","title":"example failed","location":{"file":"calc.onus","def":"clamp","span":[[11,3],[11,33]]},"context":["`clamp(x: 5, lo: 0, hi: 3) == 3` is false"],"repairs":[],"canonical_hash":"b3:700f0a22702e3f70f6fd40bcdf5c9642d94897a08f663b02cfc0c1f98a7afcd0"}],"best_attempt":{"iteration":1,"diagnostics":1,"bodies":{"calc.clamp":"pub fn clamp(x: Int, lo: Int, hi: Int where lo <= it) -> Int\n  ensures proved lo <= result and result <= hi\n{\n  return x\n}"}}}
